id,user_id,star_id,recency_score,issues,stars,repo_name,description,contributors,created_at
4060,29295102,365466475,1,0,3,DenisMirand4/Bot_Albion_Labour,,{DenisMirand4},2022-02-24T21:07:34.596111
3272,15004099,87873787,3,51,665,theNewDynamic/gohugo-theme-ananke,Ananke: A theme for Hugo Sites,"{budparr,regisphilibert}",2022-02-24T21:07:34.596111
3273,16259450,286546354,0,64,229,netlify/explorers,,"{jlengstorf,bencodezen}",2022-02-24T21:07:34.596111
3274,16259450,349213562,1,0,22,cassidoo/next-context-example,Here's an example of using React Context and useReducer with Next.js for state management.,{cassidoo},2022-02-24T21:07:34.596111
3275,16259450,3319040,2,5,7738,id-Software/DOOM,DOOM Open Source Release,{id-travis-bradshaw},2022-02-24T21:07:34.596111
3276,16259450,128416969,3,93,2674,archlinux/archinstall,"Arch Linux installer - guided, templates etc.","{Torxed,dylanmtaylor}",2022-02-24T21:07:34.596111
3277,16259450,91599439,4,7,42,KatDevsGames/z3randomizer,Zelda 3 Randomizer Template ASM,"{KatDevsGames,KevinCathcart}",2022-02-24T21:07:34.596111
3278,16259450,82222501,5,0,1,rob-moore/dotfiles,my dot files,{},2022-02-24T21:07:34.596111
3279,16259450,57461213,6,2029,3503,runelite/runelite,Open source Old School RuneScape client,"{Adam-,deathbeam}",2022-02-24T21:07:34.596111
3280,16259450,96662897,7,0,493,supercomputra/SF-Mono-Font,SF Mono Font,"{supercomputra,balcsida}",2022-02-24T21:07:34.596111
3281,16259450,156488590,8,0,1,b-marie/StackUnderflow,"This was a group project for a back end course, which is why the front end is HORRENDOUS.","{b-marie,RiverMerrill}",2022-02-24T21:07:34.596111
3282,16259450,42029482,9,18,13121,AlDanial/cloc,"cloc counts blank lines, comment lines, and physical lines of source code in many programming languages.","{AlDanial,stsnel}",2022-02-24T21:07:34.596111
3283,16259450,115813151,10,16,48,alhazmy13/angular-csv-ext,Helper library for create CSV file in Angular.,"{alhazmy13,javiertelioz}",2022-02-24T21:07:34.596111
3284,16259450,124953235,11,714,1087,hawku/TabletDriver,TabletDriver Download: http://hwk.fi/TabletDriver/TabletDriverV0.2.3.zip,"{hawku,Itsyuka}",2022-02-24T21:07:34.596111
3285,16259450,87215687,12,27,63,stonelasley/ionic-mocks,Simple test doubles for Ionic 2+ using Jasmine Spy Objects,"{stonelasley,rvdleun}",2022-02-24T21:07:34.596111
3286,16259450,79449949,13,1,235,VadimDez/ngx-order-pipe,▼ Angular 5+ orderBy pipe,"{VadimDez,DeepSnowNeeL}",2022-02-24T21:07:34.596111
3287,16259450,50213667,14,301,8106,text-mask/text-mask,"Input mask for React, Angular, Ember, Vue, & plain JavaScript","{msafi,lozjackson}",2022-02-24T21:07:34.596111
3288,16259450,236571,15,95,13753,rupa/z,z - jump around,"{rupa,ericbn}",2022-02-24T21:07:34.596111
3289,16259450,2185269,16,21,4821,busyloop/lolcat,Rainbows and unicorns!,"{m-o-e,sunpoet}",2022-02-24T21:07:34.596111
3290,16259450,49970642,17,1967,40330,yarnpkg/yarn,The 1.x line is frozen - features and bugfixes now happen on https://github.com/yarnpkg/berry,"{kittens,bestander}",2022-02-24T21:07:34.596111
3291,16259450,82820698,18,21,3467,spencermountain/spacetime,A lightweight javascript timezone library,"{spencermountain,jecraig}",2022-02-24T21:07:34.596111
3292,16259450,5890857,19,34,10906,sindresorhus/pure,"Pretty, minimal and fast ZSH prompt","{mafredri,sindresorhus}",2022-02-24T21:07:34.596111
3293,16259450,20270252,20,447,21049,feathericons/feather,Simply beautiful open source icons,"{colebemis,ashygee}",2022-02-24T21:07:34.596111
3294,16259450,46041284,21,1152,9811,VSCodeVim/Vim,:star: Vim for Visual Studio Code,"{jpoon,johnfn}",2022-02-24T21:07:34.596111
3295,16259450,53321815,22,189,10944,picturepan2/spectre,"Spectre.css - A Lightweight, Responsive and Modern CSS Framework","{picturepan2,renegat59}",2022-02-24T21:07:34.596111
3296,16259450,88367107,23,1,16,nusu/spectre.scss,port of spectre.css to sass,"{nusu,mtancoigne}",2022-02-24T21:07:34.596111
3297,16259450,63508378,24,5,1314,sindresorhus/hyper-snazzy,Elegant Hyper theme with bright colors,"{sindresorhus,connorholyday}",2022-02-24T21:07:34.596111
3298,16259450,98029592,25,56,40108,ziishaned/learn-regex,Learn regex the easy way,"{ziishaned,bueltge}",2022-02-24T21:07:34.596111
3299,16259450,14106970,26,87,11069,tachyons-css/tachyons,Functional css for humans,"{mrmrs,johno}",2022-02-24T21:07:34.596111
3300,16259450,13199036,27,5,943,thiderman/doge,wow very terminal doge,"{thiderman,tonylazarew}",2022-02-24T21:07:34.596111
3301,16259450,23120157,28,293,1661,overtake/telegram,Source code of deprecated Telegram for macos version,"{overtake,yangshun}",2022-02-24T21:07:34.596111
3302,16259450,46624643,29,138,4842,zplug/zplug,:hibiscus: A next-generation plugin manager for zsh,"{b4b4r07,NigoroJr}",2022-02-24T21:07:34.596111
3303,6241164,379900883,0,0,41,Deveshb15/real-twitter-banner,,"{Deveshb15,jainaayush01}",2022-02-24T21:07:34.596111
3304,6241164,161691324,1,35,1396,drwpow/openapi-typescript,Generate TypeScript types from Swagger OpenAPI specs,"{drwpow,DangoDev}",2022-02-24T21:07:34.596111
3305,6241164,246079929,2,5,4724,owid/covid-19-data,"Data on COVID-19 (coronavirus) cases, deaths, hospitalizations, tests • All countries • Updated daily by Our World in Data","{owidbot,edomt}",2022-02-24T21:07:34.596111
3306,6241164,150042589,3,54,17936,nostalgic-css/NES.css,NES-style CSS Framework | ファミコン風CSSフレームワーク,"{BcRikko,guastallaigor}",2022-02-24T21:07:34.596111
3307,6241164,258352165,4,5,120,whoisryosuke/next-mdx-deck,"Presentation decks using MDX, React, and Next.JS",{whoisryosuke},2022-02-24T21:07:34.596111
3308,6241164,125071028,5,1,297,wesbos/React-Context,Quick demo of how to use React's new Context API,"{wesbos,baggasumit}",2022-02-24T21:07:34.596111
3309,6241164,347749543,6,0,11,yakkomajuri/medium-to-blog,Turn your Medium posts into a Gatsby blog in 5 minutes with one command.,"{yakkomajuri,ImgBotApp}",2022-02-24T21:07:34.596111
3310,6241164,2630230,7,86,6001,mixmark-io/turndown,🛏 An HTML to Markdown converter written in JavaScript,"{domchristie,martincizek}",2022-02-24T21:07:34.596111
3450,40713709,45879586,4,17,1512,lexborisov/myhtml,Fast C/C++ HTML 5 Parser. Using threads.,"{lexborisov,Azq2}",2022-02-24T21:07:34.596111
3311,6241164,345376495,8,1,94,levelsio/inflationchart,The stock market inflation adjusted for the US-money supply,"{levelsio,daniellockyer}",2022-02-24T21:07:34.596111
3312,6241164,174038031,9,10,24947,react-hook-form/react-hook-form,📋 React Hooks for form state management and validation (Web + React Native),"{bluebill1049,kotarella1110}",2022-02-24T21:07:34.596111
3313,6241164,20929025,10,5382,76844,microsoft/TypeScript,TypeScript is a superset of JavaScript that compiles to clean JavaScript output.,"{ahejlsberg,sheetalkamat}",2022-02-24T21:07:34.596111
3314,6241164,294816887,11,2,56,bdougie/git-twitch,This is a service for GitHub and twitch interaction,"{bdougie,mishmanners}",2022-02-24T21:07:34.596111
3315,6241164,72754695,12,14,7084,styled-components/polished,A lightweight toolset for writing styles in JavaScript ✨,"{bhough,mxstbr}",2022-02-24T21:07:34.596111
3316,6241164,147350463,13,9,45617,leonardomso/33-js-concepts,📜 33 JavaScript concepts every developer should know.,"{leonardomso,ilker0}",2022-02-24T21:07:34.596111
3317,6241164,149827668,14,10,52,james-wallis/wallis.dev,My personal website,{james-wallis},2022-02-24T21:07:34.596111
3318,6241164,76569802,15,3,51,ftlabs/transcription-service,A Node.js server that accepts audio/video files and transcribes the content,"{seanmtracey,wheresrhys}",2022-02-24T21:07:34.596111
3319,6241164,35190860,16,0,118,seven1m/open-bibles,Repository of public domain and freely licensed bibles in XML and other standard formats,"{seven1m,richiebful}",2022-02-24T21:07:34.596111
3320,6241164,310490480,17,0,16,cachecleanerjeet/readme-stats-github,Generate your GitHub's Stats in SVG,{avipatilpro},2022-02-24T21:07:34.596111
3321,6241164,319185224,18,9,103,ubenmackin/ACVM,GUI frontend for qemu for Apple Silicon based Macs,"{ubenmackin,KhaosT}",2022-02-24T21:07:34.596111
3322,6241164,207877287,19,13,39,sandrinodimattia/nextjs-auth0-example,A sample application showing how your users can sign in to your Next.js application using Auth0,{sandrinodimattia},2022-02-24T21:07:34.596111
3323,6241164,234399448,20,7,7,outsrc/my-app,Secure NextJS App users with Auth0 and TypeScript,{ernestofreyreg},2022-02-24T21:07:34.596111
3324,6241164,103313840,21,26,674,wesbos/cobalt2-vscode,Cobalt2 Theme for VS Code,"{wesbos,palashmon}",2022-02-24T21:07:34.596111
3325,6241164,266309514,22,4,199,stackrole/gatsby-starter-foundation,"A starter to launch your blazing fast personal website and a blog, Built with Gatsby and Netlify CMS. Made with ❤ by Stackrole","{stackrole-dev,sksameer204}",2022-02-24T21:07:34.596111
3326,6241164,91537893,23,0,65,samyk/easel-driver,"Easel driver for Linux, Mac, Windows, ARM, Raspberry Pi, Intel, FTDI, CH340, CH341, FTDI clones, local, and remote access to GRBL-based CNC controllers","{samyk,acavella}",2022-02-24T21:07:34.596111
3327,6241164,25359717,24,409,1247,vlachoudis/bCNC,"GRBL CNC command sender, autoleveler and g-code editor","{vlachoudis,Harvie}",2022-02-24T21:07:34.596111
3328,6241164,4801382,25,179,1351,winder/Universal-G-Code-Sender,"A cross-platform G-Code sender for GRBL, Smoothieware, TinyG and G2core.","{winder,breiler}",2022-02-24T21:07:34.596111
3329,6241164,84692493,26,147,2080,tc39/proposal-temporal,Provides standard objects and functions for working with dates and times.,"{ptomato,Ms2ger}",2022-02-24T21:07:34.596111
3330,6241164,279712319,27,0,231,jordansinger/health-macos-swiftui-example,Health app macOS Big Sur built in SwiftUI,{jordansinger},2022-02-24T21:07:34.596111
3331,6241164,18573791,28,19,5750,davidmerfield/randomColor,A tiny script for generating attractive colors,"{davidmerfield,bilalq}",2022-02-24T21:07:34.596111
3332,6241164,219324014,29,11,118,nestjsx/automapper,An Object-Object AutoMapper module for NestJS.,"{nartc,bashleigh}",2022-02-24T21:07:34.596111
3333,351693,197008093,0,6,43,fmartinou/whats-up-docker,What's up Docker ( aka WUD ) gets you notified when a new version of your Docker Container is available.,"{fmartinou,ajgon}",2022-02-24T21:07:34.596111
3334,351693,48769241,1,168,6387,penpot/penpot,Penpot - The Open-Source design & prototyping platform,"{niwinz,Alotor}",2022-02-24T21:07:34.596111
3335,351693,395280574,2,1,12,NdR91/NdR-PhoneUI,,{},2022-02-24T21:07:34.596111
3336,351693,63965783,3,723,4056,swimlane/ngx-charts,:bar_chart: Declarative Charting Framework for Angular,"{marjan-georgiev,amcdnl}",2022-02-24T21:07:34.596111
3337,351693,293219477,4,51,348,gridaco/assistant,"✏️  Bring your design & development pipeline to the next level - with design to code, in-design-content-management, component management, tools for faster design","{softmarshmallow,You-J}",2022-02-24T21:07:34.596111
3338,351693,396905552,5,0,5,chuvakpavel/MKDemoApp,,{chuvakpavel},2022-02-24T21:07:34.596111
3339,351693,146033470,6,0,2,ernestomancebo/angular-native-dialog,Implementation example of how to use a native dialog in an Angular project.,"{ernestomancebo,angular-cli}",2022-02-24T21:07:34.596111
3340,351693,399197552,7,0,6,CrossGeeks/ScrollRevealXFSample,,{Char0394},2022-02-24T21:07:34.596111
3341,351693,327400204,8,0,2,speijnik/myhome,Python library for interacting with MyHomeSERVER1,{speijnik},2022-02-24T21:07:34.596111
3342,351693,4130226,9,34,2343,rsnapshot/rsnapshot,"a tool for backing up your data using rsync (if you want to get help, use https://lists.sourceforge.net/lists/listinfo/rsnapshot-discuss)","{bebehei,sgpinkus}",2022-02-24T21:07:34.596111
3343,351693,8986217,10,448,9513,koreader/koreader,"An ebook reader application supporting PDF, DjVu, EPUB, FB2 and many more formats, running on Cervantes, Kindle, Kobo, PocketBook and Android devices","{houqp,chrox}",2022-02-24T21:07:34.596111
3344,351693,14346979,11,1032,5622,snipe/snipe-it,A free open source IT asset/license management system,"{snipe,dmeltzer}",2022-02-24T21:07:34.596111
3345,351693,143975804,12,144,1307,LycheeOrg/Lychee," A great looking and easy-to-use photo-management-system you can run on your server, to manage and share photos.","{ildyria,kamil4}",2022-02-24T21:07:34.596111
4201,469997,5316345,14,0,1,sobingt/testgithub,Test,{sobingt},2022-02-24T21:07:34.596111
3346,351693,263496339,13,3,8,starcrouz/plextheme-reading,Ubooquity enhanced Plex based theme with all currently reading comics list and more,"{starcrouz,ameel}",2022-02-24T21:07:34.596111
3347,351693,262782341,14,0,4,Justin27482/plextheme-progress,Ubooquity Plex Based Theme with Progress Bars and Filters,{Justin27482},2022-02-24T21:07:34.596111
3348,351693,161012019,15,594,12730,jellyfin/jellyfin,The Free Software Media System,"{LukePulverenti,Bond-009}",2022-02-24T21:07:34.596111
3349,351693,298239008,16,0,14,cornflourblue/angular-10-custom-modal,Angular 10 - Custom Modal Example,{cornflourblue},2022-02-24T21:07:34.596111
3350,351693,163753499,17,5,154,rungwiroon/BlazorGoogleMaps,Blazor interop for GoogleMap library,"{valentasm1,valentasm}",2022-02-24T21:07:34.596111
3351,351693,289188530,18,17,96,reptilex/tesla-style-solar-power-card,Home assistant power card mimicking the one tesla provides for the powerwall app.,"{reptilex,dgomes}",2022-02-24T21:07:34.596111
3352,351693,76020516,19,9,506,Mimetis/Dotmim.Sync,"A brand new database synchronization framework, multi platform, multi databases, developed on top of .Net Standard 2.0. https://dotmimsync.readthedocs.io/","{Mimetis,vunder}",2022-02-24T21:07:34.596111
3353,351693,249563107,20,0,16,wouterst79/FluidSharp,FluidSharp is a high performance mobile first multi-platform UI layout framework based on Skia.,"{wouterst79,wouterattoptal}",2022-02-24T21:07:34.596111
3354,351693,96036483,21,85,2781,ng-select/ng-select,:star: Native angular select component,"{varnastadeus,anjmao}",2022-02-24T21:07:34.596111
3355,351693,355258557,22,0,57,technorabilia/portainer-templates,Various Portainer App Templates,{technorabilia},2022-02-24T21:07:34.596111
3356,351693,391400895,23,6,136,TBens/lovelace-ui-minimalist,🌻 Lovelace UI • Minimalist,{TBens},2022-02-24T21:07:34.596111
3357,351693,398345592,24,0,1,3mer3wadh/CustomUI,Trying to create nice UI with xamarin forms ,{3mer3wadh},2022-02-24T21:07:34.596111
3358,351693,263019373,25,7,9,staticwebdev/angular-basic,,"{alexweininger,anthonychu}",2022-02-24T21:07:34.596111
3359,351693,381989425,26,0,1,Djohnnie/DotNet6-CodePaLOUsa-2021,What is new in .NET 6 and the future of .NET - Code PaLOUsa 2021,{Djohnnie},2022-02-24T21:07:34.596111
3360,351693,206950992,27,2,7,SaurabhLpRocks/vscode-workflow,Fullstack app to demonstrate end to end workflow of Angular and ASP Net Core app inside VS Code.,"{SaurabhLpRocks,Saurabh-Palatkar-Spok}",2022-02-24T21:07:34.596111
3361,351693,198002113,28,15,11,bbachi/angular-idle-timeout,An Example of implementing idle timeout in angular,{bbachi},2022-02-24T21:07:34.596111
3362,351693,94090278,29,1,34,timbru31/docker-ruby-node,"🐳 Ruby 2.6, 2.7 or 3.0 with Node.js 12 LTS (Erbium), 14 LTS (Fermium) or 16 LTS (Gallium) Docker image","{renovate-bot,timbru31}",2022-02-24T21:07:34.596111
3363,1645628,397041032,0,57,14,WordPress/Documentation-Issue-Tracker,Issue Tracker for the WordPress Documentation team.,"{Kenshino,mkaz}",2022-02-24T21:07:34.596111
3364,1645628,3327382,1,65,10468,Automattic/_s,"Hi. I'm a starter theme called _s, or underscores, if you like. I'm a theme meant for hacking so don't use me as a Parent Theme. Instead try turning me into the next, most awesome, WordPress theme out there. That's what I'm here for.","{obenland,davidakennedy}",2022-02-24T21:07:34.596111
3365,1645628,216647402,2,0,444,jeffreyvr/tailpress,TailPress is a minimal boilerplate theme for WordPress using Tailwind CSS.,{jeffreyvr},2022-02-24T21:07:34.596111
3366,1645628,303861532,3,39,66,WordPress/pattern-directory,The WordPress Block Pattern Directory,"{ryelle,StevenDufresne}",2022-02-24T21:07:34.596111
3367,1645628,289205582,4,5,530,kr1sp1n/awesome-gemini,A collection of awesome things regarding the gemini protocol ecosystem.,"{kr1sp1n,pitr}",2022-02-24T21:07:34.596111
3368,1645628,343964517,5,1,22,module-federation/microlib-examples,"This template project provides the scaffolding to build a federated application on ÆGIS. It also contains an example of an Order, Customer and Inventory service streaming to / running in the same ÆGIS host server process; and demonstrates integration with, and orchestration of, an Address, Payment, Inventory, Shipping, Event (Kafka, WebSockets), and Persistence service (MongoDB) via Aegis federated ports. ","{tysonrm,ScriptedAlchemy}",2022-02-24T21:07:34.596111
3369,1645628,246069937,6,5,106,ryersondmp/sa11y,"Sa11y is an accessibility quality assurance tool that visually highlights common accessibility and usability issues. Geared towards content authors, Sa11y straightforwardly identifies errors or warnings at the source with a simple tooltip on how to fix them.","{adamchaboryk,ryersondmp}",2022-02-24T21:07:34.596111
3370,1645628,381881172,7,4,233,sdras/js-explorer,"Find the method you need without digging through the docs, directly on the command line!","{sdras,anandshenoy14}",2022-02-24T21:07:34.596111
3371,1645628,146619556,8,9,11500,trekhleb/learn-python,📚 Playground and cheatsheet for learning Python. Collection of Python scripts that are split by topics and contain code examples with explanations.,"{trekhleb,vilmacio}",2022-02-24T21:07:34.596111
3372,1645628,229270550,9,53,382,WordPress/theme-experiments,Experimenting with themes made out of blocks.,"{kjellr,carolinan}",2022-02-24T21:07:34.596111
3373,1645628,2881789,10,213,24388,geekcomputers/Python,My Python Examples,"{geekcomputers,cclauss}",2022-02-24T21:07:34.596111
3374,1645628,75645659,11,543,1052,WordPress/wordpress-develop,"WordPress Develop, Git-ified. Synced from git://develop.git.wordpress.org/, including branches and tags! This repository is just a mirror of the WordPress subversion repository. Please include a link to a pre-existing ticket on https://core.trac.wordpress.org/ with every pull request.","{ryanboren,SergeyBiryukov}",2022-02-24T21:07:34.596111
3375,1645628,2889328,12,2,15777,WordPress/WordPress,"WordPress, Git-ified. This repository is just a mirror of the WordPress subversion repository. Please do not send pull requests. Submit pull requests to https://github.com/WordPress/wordpress-develop and patches to https://core.trac.wordpress.org/ instead.","{SergeyBiryukov,nacin}",2022-02-24T21:07:34.596111
3376,1645628,56717493,13,18,28904,joshbuchea/HEAD,A simple guide to HTML <head> elements,"{joshbuchea,scottaohara}",2022-02-24T21:07:34.596111
3377,1645628,118656654,14,1263,416,Automattic/themes,Free WordPress themes made by Automattic for WordPress.org and WordPress.com.,"{allancole,scruffian}",2022-02-24T21:07:34.596111
3378,1645628,267429516,15,185,3297,concrete-utopia/utopia,Design ❤️ Code,"{Rheeseyb,balazsbajorics}",2022-02-24T21:07:34.596111
3379,60850993,3884981,0,253,3847,juce-framework/JUCE,"JUCE is an open-source cross-platform C++ application framework for desktop and mobile applications, including VST, VST3, AU, AUv3, RTAS and AAX audio plug-ins.","{ed95,julianstorer}",2022-02-24T21:07:34.596111
3380,60850993,144107489,1,3,1379,sudheerj/vuejs-interview-questions,List of 300 VueJS Interview Questions And Answers,"{sudheerj,bekliev}",2022-02-24T21:07:34.596111
3381,60850993,386951260,2,1,45,dabit3/nuxt-supabase-full-multi-user-blog,Build a mult-user blogging app with Supabase and Nuxt.js,{dabit3},2022-02-24T21:07:34.596111
3382,60850993,99351826,3,119,3131,nuxt/create-nuxt-app,Create Nuxt.js App in seconds.,"{clarkdo,Atinux}",2022-02-24T21:07:34.596111
3383,60850993,214587193,4,244,25467,supabase/supabase,The open source Firebase alternative. Follow to stay updated about our public Beta.,"{kiwicopple,MildTomato}",2022-02-24T21:07:34.596111
3384,60850993,201535836,5,26,1796,onderceylan/pwa-asset-generator,"Automates PWA asset generation and image declaration. Automatically generates icon and splash screen images, favicons and mstile images. Updates manifest.json and index.html files with the generated images according to Web App Manifest specs and Apple Human Interface guidelines.","{onderceylan,semantic-release-bot}",2022-02-24T21:07:34.596111
3385,60850993,143763564,6,1,87,cosmicjs/vue-music-website,Music website built with Vue.js and Cosmic JS,"{zezic,tonyspiro}",2022-02-24T21:07:34.596111
3386,60850993,222450899,7,1,3,slidenerd/nuxt-auth,A dummy example to test nuxtjs with passport authentication,{},2022-02-24T21:07:34.596111
3387,60850993,44571718,8,30,63460,vuejs/awesome-vue,🎉 A curated list of awesome things related to Vue.js,"{Scrum,yyx990803}",2022-02-24T21:07:34.596111
3388,60850993,317286633,9,0,43,ivodolenc/nuxt-animejs,Anime.js module for Nuxt.js,{ivodolenc},2022-02-24T21:07:34.596111
3389,60850993,76838017,10,1271,28752,iina/iina,The modern video player for macOS.,"{lhc70000,alejx}",2022-02-24T21:07:34.596111
3390,60850993,332744719,11,0,5,imadovitch/Horizontal-Animation-on-Vertical-Scroll-using-Vue.js-TailwindCSS,,{imadovitch},2022-02-24T21:07:34.596111
3391,60850993,306971358,12,0,35,imadovitch/Music-Player-App-built-with-Vue.js-Vue3-and-Howler.js,,{imadovitch},2022-02-24T21:07:34.596111
3392,60850993,171563505,13,0,385,Asabeneh/JavaScript-for-Everyone,A step by step guide to learn JavaScript and programming,"{Asabeneh,engineerabdulsalam}",2022-02-24T21:07:34.596111
3393,60850993,229764465,14,33,11430,Asabeneh/30-Days-Of-JavaScript,"30 days of JavaScript programming challenge is a step-by-step guide to learn JavaScript programming language in 30 days. This challenge may take more than 100 days,  please just follow your own pace. ","{Asabeneh,npnjuguna}",2022-02-24T21:07:34.596111
3394,60850993,195070986,15,20,1184,rogden/tailwind-config-viewer,A local UI tool for visualizing your Tailwind CSS configuration file.,"{rogden,olets}",2022-02-24T21:07:34.596111
3395,60850993,50658096,16,10,108,kehers/paystack,Nodejs API wrapper for Paystack,"{Subomi,kehers}",2022-02-24T21:07:34.596111
3396,60850993,21737465,17,36,181071,sindresorhus/awesome,😎 Awesome lists about all kinds of interesting topics,"{sindresorhus,davisonio}",2022-02-24T21:07:34.596111
3397,60850993,85386965,18,10,584,acekyd/made-in-nigeria,It is rumored that Nigerians only know how to consume tools and not create them. Here is a curation of awesome tools built by Nigerians that can be used by anybody and from anywhere in the world.,"{acekyd,whizkydee}",2022-02-24T21:07:34.596111
3398,60850993,44882201,19,51,37303,MunGell/awesome-for-beginners,A list of awesome beginners-friendly projects.,"{MunGell,JefMari}",2022-02-24T21:07:34.596111
3399,60850993,320365682,20,0,2,thembari/API,,{vinosamari},2022-02-24T21:07:34.596111
3400,60850993,199474970,21,0,9,bdelate/django-flutterwave,Django integration for Flutterwave Rave payments and subscriptions,{bdelate},2022-02-24T21:07:34.596111
3401,60850993,97014480,22,292,1470,nesdis/djongo,Django and MongoDB database connector,"{nesdis,jay20162016}",2022-02-24T21:07:34.596111
3402,60850993,280940271,23,0,1,Maduflavins/paystackimplementation,,{Maduflavins},2022-02-24T21:07:34.596111
3403,60850993,321747929,24,0,1,Olamidun/pricetrackerapi,Api that tracks the price of items on jumia,{Olamidun},2022-02-24T21:07:34.596111
3404,60850993,54346799,25,7,172342,public-apis/public-apis,A collective list of free APIs,"{davemachado,matheusfelipeog}",2022-02-24T21:07:34.596111
3405,60850993,70418925,26,18,378,sithis993/Crypter,Crypter - Python3 based builder and ransomware compiled to Windows executable using PyInstaller,{sithis993},2022-02-24T21:07:34.596111
3406,60850993,290264556,27,0,4,Gloryness/Multiprocessing-in-PyQt5,Use this program to test how many threads can run at once while doing the same tasks.,{Gloryness},2022-02-24T21:07:34.596111
3407,60850993,13491895,28,40,217091,EbookFoundation/free-programming-books,:books: Freely available programming books,"{vhf,MHM5000}",2022-02-24T21:07:34.596111
3408,60850993,8936633,29,17,9324,maxogden/art-of-node,:snowflake: a short introduction to node.js,"{maxogden,zeke}",2022-02-24T21:07:34.596111
3409,38838958,343033262,0,0,7,larissabenedet/lol-champions,"o LOL Champions é um site que lista todos os personagens do jogo League of Legends e suas respectivas informações, contendo um campo de pesquisa caso busque um campeão específico. Toda vez que um novo personagem surgir no jogo ele será automaticamente incluso na página. ",{larissabenedet},2022-02-24T21:07:34.596111
3410,38838958,156914027,1,17,2834,isaachinman/next-i18next,The easiest way to translate your NextJs apps.,"{isaachinman,capellini}",2022-02-24T21:07:34.596111
3411,38838958,383845459,2,0,4,lorenaaze/codewars.desafios,Solução de desafios encontrados na plataforma codewars ,{lorenaaze},2022-02-24T21:07:34.596111
3412,38838958,34134519,3,0,4,awvalenti/materialdidatico,Material didático para assuntos gerais de desenvolvimento de software,{awvalenti},2022-02-24T21:07:34.596111
3413,38838958,149731937,4,6,729,remotemobprogramming/mob,Tool for smooth git handover.,"{simonharrer,gregorriegler}",2022-02-24T21:07:34.596111
3414,38838958,184456251,5,2097,65379,microsoft/PowerToys,Windows system utilities to maximize productivity,"{bao-qian,crutkas}",2022-02-24T21:07:34.596111
3415,38838958,1542281,6,13,1140,ChrisMarinos/FSharpKoans,"A simple, fun, and interactive way to learn the F# language through testing.","{ChrisMarinos,dsyme}",2022-02-24T21:07:34.596111
3416,3846874,52630616,0,556,17087,apollographql/apollo-client,":rocket:  A fully-featured, production ready caching GraphQL client for every UI framework and GraphQL server.","{benjamn,renovate-bot}",2022-02-24T21:07:34.596111
3417,3846874,14210523,1,299,9392,yargs/yargs," yargs the modern, pirate-themed successor to optimist.","{bcoe,substack}",2022-02-24T21:07:34.596111
