id,user_id,star_id,recency_score,issues,stars,repo_name,description,contributors,created_at
1226,27487712,174715721,17,1,914,pr0g/cmake-examples,"A collection of as simple as possible, modern CMake projects","{pr0g,0xflotus}",2022-02-24T21:07:34.596111
1227,27487712,165822880,18,0,2,o11c/makefile-demo,,{o11c},2022-02-24T21:07:34.596111
1228,27487712,64504667,19,0,946,MBMIT/MBM-Artwork,MBM Artwork,{mariobehling},2022-02-24T21:07:34.596111
1229,27487712,111915629,20,0,944,MBMIT/MBM-Sandbox,Sandbox for MBM,{mariobehling},2022-02-24T21:07:34.596111
1230,27487712,111915571,21,0,943,MBMIT/MBM-Projects,Project Listings of MBM,{mariobehling},2022-02-24T21:07:34.596111
1231,27487712,157518025,22,0,518,MBMIT/neurolab-android,Neurolab Android,{mariobehling},2022-02-24T21:07:34.596111
1232,27487712,157519737,23,0,511,MBMIT/neurolab-hardware,Neurolab Hardware,"{mariobehling,CloudyPadmal}",2022-02-24T21:07:34.596111
1233,27487712,53432291,24,0,747,Orbiter/timesheet,Android application for tracking time for different charge numbers,"{ambrice,seawolf}",2022-02-24T21:07:34.596111
1234,27487712,6260037,25,0,744,Orbiter/yacy-search,"A simple web search application based on YaCy, a peer-to-peer web search engine.",{},2022-02-24T21:07:34.596111
1235,27487712,111914725,26,0,956,MBMIT/mbmit.github.io,Website at http://mbmit.com,"{mariobehling,vanhonit}",2022-02-24T21:07:34.596111
1236,27487712,105300337,27,0,739,Orbiter/yacy_grid_ui,YaCy Grid Front Page,"{Orbiter,luccioman}",2022-02-24T21:07:34.596111
1237,27487712,22654023,28,0,901,MBMIT/interges.github.io,Interges Website,{mariobehling},2022-02-24T21:07:34.596111
1238,27487712,91309349,29,0,744,Orbiter/Test_voice_input,,{chiragw15},2022-02-24T21:07:34.596111
1239,55982424,69609,0,737,3321,internetarchive/openlibrary,One webpage for every book ever published!,"{mekarpeles,anandology}",2022-02-24T21:07:34.596111
1240,55982424,401173533,1,0,51,ginoleeswan/hero,A superhero encyclopaedia made in React Native. Pulls from the SuperHeroAPI & ComicVine API,{ginoleeswan},2022-02-24T21:07:34.596111
1241,55982424,55313340,2,1,211,shlomif/fortune-mod,"Implementation of the Unix fortune command for displaying a random quotation, for Linux and other systems.","{shlomif,telometto}",2022-02-24T21:07:34.596111
1242,55982424,180328715,3,27,12387,pmndrs/zustand,🐻 Bear necessities for state management in React,"{drcmda,dai-shi}",2022-02-24T21:07:34.596111
1243,55982424,115229134,4,17,11984,mdx-js/mdx,Markdown for the component era,"{johno,wooorm}",2022-02-24T21:07:34.596111
1244,55982424,377452626,5,22,174,atapas/webapis-playground,The Web APIs Playground is a project to showcase the JavaScript Web APIs with examples and demonstrations. Client-side JavaScript APIs are here to help with providing wrapper functions for many low-level tasks.,"{atapas,mverissimo}",2022-02-24T21:07:34.596111
1245,55982424,395006251,6,5,32,Lalit2005/paperclip,"The only note taking and productivity tool you will ever need From notes, todo lists, sticky notes to pomorodo timer and HTML-CSS playgorund, Paperclip is everything you will ever need",{Lalit2005},2022-02-24T21:07:34.596111
1377,63254295,61319303,2,42,588,adrcotfas/Goodtime,:hourglass_flowing_sand: productivity app for Android,"{adrcotfas,fdw}",2022-02-24T21:07:34.596111
22,61815862,82836080,0,17,355,HaikuTeam/animator,Design tool for creating Lottie animations and interactive web components,"{matthewtoast,stristr}",2022-02-24T21:07:34.596111
23,61815862,221316636,1,140,419,airsonic-advanced/airsonic-advanced,,"{randomnicode,muff1nman}",2022-02-24T21:07:34.596111
24,61815862,165093478,2,8,85,stephane-r/HoloPlay,React-Native app using Invidious API for listening Youtube audio source.,"{stephane-r,splyy}",2022-02-24T21:07:34.596111
25,61815862,185131263,3,7,385,calebnance/expo-spotify,Spotify UI Clone with React Native & Expo,"{calebnance,bidah}",2022-02-24T21:07:34.596111
26,61815862,211595183,4,0,303,osamaqarem/spotify-lite,Spotify Lite made with React Native for iOS and Android,{osamaqarem},2022-02-24T21:07:34.596111
27,61815862,341582109,5,8,1780,trungk18/angular-spotify,"Spotify client built with Angular 12, Nx Workspace, ngrx, TailwindCSS and ng-zorro","{trungk18,nikosanif}",2022-02-24T21:07:34.596111
28,61815862,56549856,6,13,101,fennifith/Pasta-for-Spotify,A material design Spotify client for Android,"{fennifith,TheAndroidMaster}",2022-02-24T21:07:34.596111
29,61815862,165434192,7,39,661,dvx/lofi,🎵🔉 A mini Spotify player with WebGL visualizations.,"{dvx,stamoun}",2022-02-24T21:07:34.596111
30,61815862,51870853,8,265,2131,SimpleMobileTools/Simple-Gallery,Browse your memories without any interruptions with this photo and video gallery,"{tibbi,solokot}",2022-02-24T21:07:34.596111
31,61815862,12888993,9,1550,48378,home-assistant/core,:house_with_garden: Open source home automation that puts local control and privacy first.,"{balloob,fabaff}",2022-02-24T21:07:34.596111
32,61815862,416408131,10,7,75,mattn/tailscale-systray,Linux port of tailscale system tray menu.,"{mattn,codenoid}",2022-02-24T21:07:34.596111
33,61815862,363988779,11,1,41,muchobien/tailscale-ui,Tailscale UI for Ubuntu,"{Lokeon,KROSF}",2022-02-24T21:07:34.596111
34,61815862,283323929,12,22,1932,haimgel/display-switch,Turn a $30 USB switch into a full-featured multi-monitor KVM switch,"{haimgel,andornaut}",2022-02-24T21:07:34.596111
35,61815862,368365410,13,0,1,xsky13/RedFeed,RedFeed: a Reddit Feed,{xsky13},2022-02-24T21:07:34.596111
36,61815862,438686004,14,0,1,xsky13/online-compiler,An online code compiler,{xsky13},2022-02-24T21:07:34.596111
37,61815862,376732923,15,0,1,kibybyte/kibybyte,Kibybyte's Website,{kibybyte},2022-02-24T21:07:34.596111
38,61815862,403714743,16,7,53,MilkyDeveloper/cb-linux,Linux for Chromebooks,{MilkyDeveloper},2022-02-24T21:07:34.596111
39,61815862,237523442,17,645,6196,tailscale/tailscale,"The easiest, most secure way to use WireGuard and 2FA.","{bradfitz,danderson}",2022-02-24T21:07:34.596111
40,61815862,70942762,18,127,712,danielyxie/bitburner,Bitburner Game,"{hydroflame,danielyxie}",2022-02-24T21:07:34.596111
41,61815862,439057606,19,3,867,DavidBuchanan314/ambiguous-png-packer,Craft PNG files that appear completely different in Apple software,"{DavidBuchanan314,mnixry}",2022-02-24T21:07:34.596111
330,20734038,226112204,8,1,1,rodridev77/crud-cadastro,,{markusbue},2022-02-24T21:07:34.596111
42,61815862,381575565,20,12,25,tjhorner/archivebox-exporter,Automatically or manually send pages from your browser to your ArchiveBox for archival.,{tjhorner},2022-02-24T21:07:34.596111
43,61815862,313958197,21,2,25,fthx/workspaces-bar,GNOME Shell extension that shows workspaces buttons in top panel,"{fthx,null-git}",2022-02-24T21:07:34.596111
44,61815862,247350713,22,18,1334,m1k1o/neko,A self hosted virtual browser that runs in docker and uses WebRTC.,"{m1k1o,nurdism}",2022-02-24T21:07:34.596111
45,61815862,169975410,23,59,8160,leon-ai/leon,🧠 Leon is your open-source personal assistant.,"{louistiti,Divlo}",2022-02-24T21:07:34.596111
46,61815862,335402819,24,6,883,plasmicapp/plasmic,"Visually build pages and frontends, lightning-fast. Plug into your React codebase. Empower anyone to ship.","{chungwu,victoragnez}",2022-02-24T21:07:34.596111
47,61815862,128565937,25,0,21036,iamadamdev/bypass-paywalls-chrome,Bypass Paywalls web browser extension for Chrome and Firefox.,"{iamadamdev,iscreamcoke}",2022-02-24T21:07:34.596111
48,61815862,41889031,26,1037,15880,TeamNewPipe/NewPipe,A libre lightweight streaming front-end for Android.,"{theScrabi,TobiGr}",2022-02-24T21:07:34.596111
49,61815862,418353420,27,0,1,AndBible/docs,User documentation (readthedocs),{agrogers},2022-02-24T21:07:34.596111
50,61815862,337216037,28,0,4,arch-linux-calamares-installer/alci-iso-pure,,{erikdubois},2022-02-24T21:07:34.596111
51,61815862,7715820,29,71,8398,davatorium/rofi,"Rofi: A window switcher, application launcher and dmenu replacement","{DaveDavenport,sardemff7}",2022-02-24T21:07:34.596111
52,16268467,14370955,0,45,32496,sahat/hackathon-starter,A boilerplate for Node.js web applications,"{sahat,YasharF}",2022-02-24T21:07:34.596111
53,16268467,19415064,1,10,103954,ossu/computer-science,:mortar_board: Path to a free self-taught education in Computer Science!,"{ericdouglas,joshmhanson}",2022-02-24T21:07:34.596111
54,16268467,177736533,2,16833,260255,996icu/996.ICU,Repo for counting stars and contributing. Press F to pay respect to glorious developers.,"{996icu,ChangedenCZD}",2022-02-24T21:07:34.596111
55,16268467,27193779,3,1627,83892,nodejs/node,Node.js JavaScript runtime :sparkles::turtle::rocket::sparkles:,"{ry,Trott}",2022-02-24T21:07:34.596111
56,16268467,189098079,4,2,105,lmammino/streams-workshop,A workshop on Node.js Streams,"{lmammino,brian-childress}",2022-02-24T21:07:34.596111
57,16268467,16604381,5,5,1672,sergtitov/NodeJS-Learning,"This page contains collection of curated links to blog posts, articles, videos, tutorials, books, frameworks, modules, IDEs, testing tools, hosting providers, etc. to help you learn Node.js and keep up to date.","{sergtitov,Saurabh-hooda}",2022-02-24T21:07:34.596111
58,16268467,16194327,6,10,5546,adamschwartz/magic-of-css,A CSS course to turn you into a magician.,"{adamschwartz,cvrebert}",2022-02-24T21:07:34.596111
59,16268467,172471552,7,5,3694,aliyr/Nodejs-Developer-Roadmap,A Developer Roadmap to becoming a Node.js developer in 2019,"{aliyr,AGrant24}",2022-02-24T21:07:34.596111
60,16268467,71583602,8,2,25417,Developer-Y/cs-video-courses,List of Computer Science courses with video lectures.,"{Developer-Y,DateBro}",2022-02-24T21:07:34.596111
61,16268467,333421996,9,5,4756,therealsreehari/Learn-Data-Science-For-Free,"This repositary is a combination of different resources lying scattered all over the internet. The reason for making such an repositary is to combine all the valuable resources in a sequential manner, so that it helps every beginners who are in a search of free and structured learning resource for Data Science. For Constant Updates Follow me in Twitter.","{therealsreehari,tuxiqae}",2022-02-24T21:07:34.596111
62,16268467,132757250,10,0,62,charlax/entrepreneurship-resources,"A list of articles, books, videos related to entrepreneurship",{charlax},2022-02-24T21:07:34.596111
63,16268467,23083156,11,909,73873,mui-org/material-ui,"MUI (formerly Material-UI) is the React UI library you always wanted. Follow your own design system, or start with Material Design.","{oliviertassinari,dmtrKovalenko}",2022-02-24T21:07:34.596111
64,7860023,148236762,0,2,8,BrunoMNDantas/TPL4J,Task Parallel Library for Java,{BrunoMNDantas},2022-02-24T21:07:34.596111
65,7860023,93390294,1,3,303,lanten/electron-antd,Create a desktop app with Electron + Typescript + React + Antd,"{lanten,Immortalt}",2022-02-24T21:07:34.596111
66,7860023,231329928,2,1,50,kat-tax/ult,The Ultimate Dev Stack,{Cavitt},2022-02-24T21:07:34.596111
67,7860023,86981224,3,7,4918,maximegris/angular-electron,Ultra-fast bootstrapping with Angular and Electron (Typescript + SASS + Hot Reload) :speedboat:,"{maximegris,whyboris}",2022-02-24T21:07:34.596111
68,7860023,105649273,4,129,6089,ElectronNET/Electron.NET,":electron: Build cross platform desktop apps with ASP.NET Core (Razor Pages, MVC, Blazor).","{GregorBiswanger,robertmuehsig}",2022-02-24T21:07:34.596111
69,7860023,205812745,5,13,13497,mitesh77/Best-Flutter-UI-Templates,completely free for everyone. Its build-in Flutter Dart.,"{mitesh77,IAmSarthakVerma}",2022-02-24T21:07:34.596111
70,7860023,193344063,6,3,1127,JideGuru/FlutterFoodybite,Flutter representation of a Restaurant app UI.,"{JideGuru,Shamsudeen12}",2022-02-24T21:07:34.596111
71,7860023,14862081,7,0,1,adiel/coypu,"Intuitive, robust browser automation for .Net","{adiel,citizenmatt}",2022-02-24T21:07:34.596111
72,7860023,32280638,8,13,1815,bonigarcia/webdrivermanager,Automated driver management and Docker builder for Selenium WebDriver,"{bonigarcia,eliasnogueira}",2022-02-24T21:07:34.596111
73,23166349,71823870,0,152,3630,prometheus-operator/kube-prometheus,Use Prometheus to monitor Kubernetes and applications running on Kubernetes,"{brancz,paulfantom}",2022-02-24T21:07:34.596111
74,23166349,15452919,1,304,34330,ethereum/go-ethereum,Official Go implementation of the Ethereum protocol,"{obscuren,karalabe}",2022-02-24T21:07:34.596111
75,23166349,301734306,2,13,69,cycloidio/terracost,Cloud cost estimation for Terraform in your CLI,"{xescugc,xlr-8}",2022-02-24T21:07:34.596111
76,23166349,16554739,3,1557,10536,elastic/beats,:tropical_fish: Beats - Lightweight shippers for Elasticsearch & Logstash ,"{ruflin,andrewkroh}",2022-02-24T21:07:34.596111
77,23166349,507775,4,3709,57880,elastic/elasticsearch,"Free and Open, Distributed, RESTful Search Engine","{kimchy,s1monw}",2022-02-24T21:07:34.596111
78,23166349,155368246,5,311,1714,elastic/cloud-on-k8s,Elastic Cloud on Kubernetes,"{sebgl,pebrc}",2022-02-24T21:07:34.596111
79,23166349,50365232,6,230,2838,werf/werf,"The CLI tool gluing Git, Docker, Helm, and Kubernetes with any CI system to implement CI/CD and Giterminism","{distorhead,alexey-igrychev}",2022-02-24T21:07:34.596111
80,23166349,246956544,7,14,3635,alexandresanlim/Badges4-README.md-Profile,👩‍💻👨‍💻 Improve your README.md profile with these amazing badges.,"{alexandresanlim,mrhrifat}",2022-02-24T21:07:34.596111
81,23166349,205724327,8,3,1465,storax/kubedoom,Kill Kubernetes pods by playing Id's DOOM!,"{storax,cpressland}",2022-02-24T21:07:34.596111
82,23166349,432722169,9,0,4,mrwilson/advent-of-code-2021,It's back. It's worse.,{mrwilson},2022-02-24T21:07:34.596111
83,23166349,59522149,10,353,5465,gruntwork-io/terragrunt,Terragrunt is a thin wrapper for Terraform that provides extra tools for working with multiple Terraform modules.,"{brikis98,yorinasub17}",2022-02-24T21:07:34.596111
84,23166349,71359796,11,29,555,open-sauced/open-sauced,🍕  This is a project to identify your next open source contribution. ,"{bdougie,0-vortex}",2022-02-24T21:07:34.596111
85,23166349,81497153,12,213,4769,kubernetes-sigs/external-dns,"Configure external DNS servers (AWS Route53, Google CloudDNS and others) for Kubernetes Ingresses and Services","{k8s-ci-robot,linki}",2022-02-24T21:07:34.596111
86,23166349,138716355,13,41,886,banzaicloud/logging-operator,Logging operator for Kubernetes based on Fluentd and Fluentbit,"{ahma,tarokkk}",2022-02-24T21:07:34.596111
87,23166349,284951208,14,19,277,Threagile/threagile,Agile Threat Modeling Toolkit,"{cschneider4711,scottbrown}",2022-02-24T21:07:34.596111
88,23166349,85039965,15,244,2391,litmuschaos/litmus,Litmus helps  SREs and developers practice chaos engineering in a Cloud-native way. Chaos experiments are published at the ChaosHub  (https://hub.litmuschaos.io). Community notes is at https://hackmd.io/a4Zu_sH4TZGeih-xCimi3Q,"{ksatchit,rajdas98}",2022-02-24T21:07:34.596111
89,23166349,237592115,16,0,1,55-Degrees/worksheets,Worksheets and other tools,{julia-55d},2022-02-24T21:07:34.596111
90,23166349,23096959,17,7473,93649,golang/go,The Go programming language,"{rsc,griesemer}",2022-02-24T21:07:34.596111
91,23166349,116825580,18,27,1967,kubernetes-sigs/kubefed,Kubernetes Cluster Federation,"{k8s-ci-robot,marun}",2022-02-24T21:07:34.596111
92,23166349,189840,19,429,13178,fabric/fabric,"Simple, Pythonic remote execution and deployment.","{bitprophet,davidjmemmett}",2022-02-24T21:07:34.596111
93,23166349,237523442,20,645,6196,tailscale/tailscale,"The easiest, most secure way to use WireGuard and 2FA.","{bradfitz,danderson}",2022-02-24T21:07:34.596111
94,23166349,130879558,21,696,6308,gitpod-io/gitpod,Gitpod automates the provisioning of ready-to-code development environments. ,"{aledbf,csweichel}",2022-02-24T21:07:34.596111
95,23166349,164419238,22,6,3787,bregman-arie/devops-resources,"DevOps resources - Linux, Jenkins, AWS, SRE, Prometheus, Docker, Python, Ansible, Git, Kubernetes, Terraform, OpenStack, SQL, NoSQL, Azure, GCP","{bregman-arie,RishiKumarRay}",2022-02-24T21:07:34.596111
96,23166349,415122580,23,28,1951,m3o/m3o,Next Generation Cloud Platform,"{asim,crufter}",2022-02-24T21:07:34.596111
97,23166349,337496044,24,1,33,cncf/cartografos,The Cartografos working group aims to provide tools to help adopters and end-users to navigate the CNCF landscape and the wider cloud native ecosystem.,"{daniellemcook,siforster}",2022-02-24T21:07:34.596111
98,23166349,292861557,25,45,2614,gitpod-io/openvscode-server,"Run upstream VS Code on a remote machine with access through a modern web browser from any device, anywhere.","{bpasero,jrieken}",2022-02-24T21:07:34.596111
99,23166349,41964498,26,87,2645,prometheus/blackbox_exporter,Blackbox prober exporter,"{brian-brazil,SuperQ}",2022-02-24T21:07:34.596111
100,23166349,366397300,27,3,643,TheZoraiz/ascii-image-converter,A cross-platform command-line tool to convert images into ascii art and print them on the console. Now supports braille art!,"{TheZoraiz,xmarcos}",2022-02-24T21:07:34.596111
101,23166349,212639071,28,12,19951,bregman-arie/devops-exercises,"Linux, Jenkins, AWS, SRE, Prometheus, Docker, Python, Ansible, Git, Kubernetes, Terraform, OpenStack, SQL, NoSQL, Azure, GCP, DNS, Elastic, Network, Virtualization. DevOps Interview Questions","{bregman-arie,surister}",2022-02-24T21:07:34.596111
102,23166349,164225648,29,0,672,David-VTUK/CKA-StudyGuide,Study guide for the CKA exam,"{David-VTUK,chipzoller}",2022-02-24T21:07:34.596111
103,45293863,17620347,0,2203,26844,dotnet/aspnetcore,"ASP.NET Core is a cross-platform .NET framework for building modern cloud-based web applications on Windows, Mac, or Linux.","{pranavkm,aspnetci}",2022-02-24T21:07:34.596111
104,45293863,112475135,1,0,5,AndreiShenets/code-styles,Styles I recommend at the moment,"{AndreiShenets,andrei-shenets-itechart}",2022-02-24T21:07:34.596111
105,45293863,71359796,2,29,555,open-sauced/open-sauced,🍕  This is a project to identify your next open source contribution. ,"{bdougie,0-vortex}",2022-02-24T21:07:34.596111
106,45293863,414238384,3,0,35,Dzoukr/Funcaster,⚡ Serverless .NET solution for hosting your 🔊 podcasts with (nearly) zero costs using Azure Functions and Azure Storage Account.,{Dzoukr},2022-02-24T21:07:34.596111
107,10951893,271436599,0,9,32,lowerbarriers/finished-starter,"Free website ready to go in one click, with blog, events, e-commerce, search, and everything else. Blazing fast JAMstack performance, vanilla JS and utility-first CSS, and opinionated in all the right ways.",{ao5357},2022-02-24T21:07:34.596111
108,10951893,235434204,1,35,4699,benbusby/whoogle-search,"A self-hosted, ad-free, privacy-respecting metasearch engine","{benbusby,vacom13}",2022-02-24T21:07:34.596111
109,10951893,193833307,2,54,7311,knadh/listmonk,"High performance, self-hosted, newsletter and mailing list manager with a modern dashboard. Single binary app.","{knadh,mr-karan}",2022-02-24T21:07:34.596111
110,10951893,17689377,3,23,7113,pre-commit/pre-commit,A framework for managing and maintaining multi-language pre-commit hooks.,"{asottile,struys}",2022-02-24T21:07:34.596111
111,10951893,196993956,4,29,683,sourcery-ai/sourcery,Refactor Python using AI. ⭐  this repo and Sourcery Starbot will send you a PR,"{brendanator,Hellebore}",2022-02-24T21:07:34.596111
112,10951893,208143342,5,5,82,github-craftwork/start-here,You should open this repo first,"{bdougie,JayantGoel001}",2022-02-24T21:07:34.596111
113,10951893,167596974,6,81,1230,pyenv-win/pyenv-win,"pyenv for Windows. pyenv is a simple python version management tool. It lets you easily switch between multiple versions of Python. It's simple, unobtrusive, and follows the UNIX tradition of single-purpose tools that do one thing well.","{kirankotari,dedale}",2022-02-24T21:07:34.596111
114,10951893,153500249,7,85,16972,sdras/awesome-actions,A curated list of awesome actions to use on GitHub,"{gep13,sdras}",2022-02-24T21:07:34.596111
115,10951893,295774370,8,670,3895,mdn/content,The content behind MDN Web Docs,"{teoli2003,hamishwillee}",2022-02-24T21:07:34.596111
116,10951893,151799924,9,4,375,mazipan/hello-open-source,🖐️ A repository to learn about open source code contributions flow,"{mazipan,drepram}",2022-02-24T21:07:34.596111
117,10951893,420484145,10,1,2,jramirez857/email-cleaner,,{jramirez857},2022-02-24T21:07:34.596111
118,10951893,255378816,11,107,5303,bigskysoftware/htmx,</> htmx - high power tools for HTML,"{1cg,bencroker}",2022-02-24T21:07:34.596111
119,10951893,319935795,12,0,8,zawad2221/Twitter-Django-Bot,Twitter Bot who like and retweet #django #python. ,{zawad2221},2022-02-24T21:07:34.596111
120,10951893,83462592,13,11,1317,asottile/pyupgrade,A tool (and pre-commit hook) to automatically upgrade syntax for newer versions of the language.,"{asottile,mxr}",2022-02-24T21:07:34.596111
121,10951893,4164482,14,163,61423,django/django,The Web framework for perfectionists with deadlines.,"{timgraham,adrianholovaty}",2022-02-24T21:07:34.596111
122,10951893,187915200,15,38,2584,peaceiris/actions-gh-pages,GitHub Actions for GitHub Pages 🚀 Deploy static files and publish your site easily. Static-Site-Generators-friendly.,"{peaceiris,corollari}",2022-02-24T21:07:34.596111
123,10951893,1195619,16,24,703,Frozen-Flask/Frozen-Flask,Freezes a Flask application into a set of static files.,"{SimonSapin,tswast}",2022-02-24T21:07:34.596111
124,10951893,389731072,17,0,44,mikeckennedy/jinja_partials,Simple reuse of partial HTML page templates in the Jinja template language for Python web frameworks.,"{mikeckennedy,vrslev}",2022-02-24T21:07:34.596111
125,10951893,404249420,18,0,25,WardPearce/thanker,"Don't be a wanker, be a thanker! Automatically give thanks to Pypi packages you use in your project.",{WardPearce},2022-02-24T21:07:34.596111
126,10951893,220809393,19,40,31785,willmcgugan/rich,Rich is a Python library for rich text and beautiful formatting in the terminal.,"{willmcgugan,nathanrpage97}",2022-02-24T21:07:34.596111
127,10951893,1446467,20,954,7628,pypa/pip,The Python package installer,"{pradyunsg,dstufft}",2022-02-24T21:07:34.596111
128,10951893,22258112,21,34,1558,quantifiedcode/python-anti-patterns,An open collection of Python anti-patterns and worst practices.,"{kaycebasques,adewes}",2022-02-24T21:07:34.596111
129,10951893,11276147,22,23,23158,cmderdev/cmder,Lovely console emulator package for Windows,"{daxgames,Stanzilla}",2022-02-24T21:07:34.596111
130,10951893,4578002,23,14,29905,faif/python-patterns,A collection of design patterns/idioms in Python,"{faif,gyermolenko}",2022-02-24T21:07:34.596111
131,10951893,264806346,24,0,24,justmedude/pylotoncycle,Python Library for getting your Peloton workout data,"{justmedude,fabaff}",2022-02-24T21:07:34.596111
132,10951893,323048702,25,27,8791,GamestonkTerminal/GamestonkTerminal,Investment Research for Everyone.,"{DidierRLopes,aia}",2022-02-24T21:07:34.596111
133,10951893,267958226,26,7,2711,dwisiswant0/apkleaks,"Scanning APK file for URIs, endpoints & secrets.","{dwisiswant0,U039b}",2022-02-24T21:07:34.596111
134,10951893,6750871,27,66,7688,arrow-py/arrow,🏹 Better dates & times for Python,"{jadchaar,crsmithdev}",2022-02-24T21:07:34.596111
135,10951893,336531380,28,17,1478,iam-abbas/Reddit-Stock-Trends,Fetch currently trending stocks on Reddit,"{iam-abbas,vmuriart}",2022-02-24T21:07:34.596111
136,10951893,254660586,29,9,1963,openmainframeproject/cobol-programming-course,Training materials and labs for a 'Getting Started' level course on COBOL,"{MikeBauerCA,tanto259}",2022-02-24T21:07:34.596111
137,24553355,68720867,0,1303,21874,firstcontributions/first-contributions,🚀✨ Help beginners to contribute to open source projects,"{firstcontributions-bot,Roshanjossey}",2022-02-24T21:07:34.596111
138,24553355,28457823,1,122,337698,freeCodeCamp/freeCodeCamp,freeCodeCamp.org's open-source codebase and curriculum. Learn to code for free.,"{QuincyLarson,raisedadead}",2022-02-24T21:07:34.596111
139,24553355,400528139,2,39,267,tinkoff-ai/etna,ETNA – Time-Series Library,"{Mr-Geekman,alex-hse-repository}",2022-02-24T21:07:34.596111
140,24553355,21737465,3,36,181068,sindresorhus/awesome,😎 Awesome lists about all kinds of interesting topics,"{sindresorhus,davisonio}",2022-02-24T21:07:34.596111
141,24553355,88475372,4,0,99,nin-jin/slides,Мои слайды для конференций,"{nin-jin,nin--jin}",2022-02-24T21:07:34.596111
142,24553355,107937815,5,613,6356,aws/amazon-sagemaker-examples,"Example 📓 Jupyter notebooks that demonstrate how to build, train, and deploy machine learning models using 🧠 Amazon SageMaker. ","{djarpin,hsl89}",2022-02-24T21:07:34.596111
143,24553355,147919799,6,6,7546,yandexdataschool/nlp_course,YSDA course in Natural Language Processing,"{justheuristic,drt7}",2022-02-24T21:07:34.596111
144,24553355,301706792,7,0,32,rolling-scopes-school/nodejs-aws-tasks,,"{SergeyKovalchuk,angry-coconut}",2022-02-24T21:07:34.596111
145,24553355,256401220,8,0,1396,alexeygrigorev/mlbookcamp-code,The code from the Machine Learning Bookcamp book and a free course based on the book,"{alexeygrigorev,ziritrion}",2022-02-24T21:07:34.596111
146,24553355,265911693,9,88,1704,orchest/orchest,"Build data pipelines, the easy way 🛠️","{ricklamers,yannickperrenet}",2022-02-24T21:07:34.596111
147,24553355,268292479,10,0,1633,ivan-bilan/The-NLP-Pandect,A comprehensive reference for all topics related to Natural Language Processing,"{ivan-bilan,anoopkunchukuttan}",2022-02-24T21:07:34.596111
148,24553355,222079167,11,34,272,shankarpandala/lazypredict,Lazy Predict help build a lot of basic models without much code and helps understand which models works better without any parameter tuning,"{shankarpandala,brendalf}",2022-02-24T21:07:34.596111
149,24553355,230359479,12,37,1596,werner-duvaud/muzero-general,MuZero,"{werner-duvaud,ahainaut}",2022-02-24T21:07:34.596111
150,24553355,122842179,13,27,6316,andrew--r/frontend-case-studies,💼 A curated list of technical talks and articles about real world enterprise frontend development,"{andrew--r,globchastyy}",2022-02-24T21:07:34.596111
