id,user_id,star_id,recency_score,issues,stars,repo_name,description,contributors,created_at
2046,33669114,292266913,11,0,216,Homebrew/discussions,🗣 Public open-ended discussions. Replacement for our Discourse.,"{MikeMcQuaid,SMillerDev}",2022-02-24T21:07:34.596111
2047,33669114,154894457,12,244,2202,open-policy-agent/gatekeeper,Gatekeeper - Policy Controller for Kubernetes,"{maxsmythe,sozercan}",2022-02-24T21:07:34.596111
2048,33669114,48714685,13,268,5997,open-policy-agent/opa,"An open source, general-purpose policy engine.","{tsandall,patrick-east}",2022-02-24T21:07:34.596111
2049,33669114,368112125,14,0,13,jansche/oss-advisors,A corporate DevRel program for honoring open source contributions,{jansche},2022-02-24T21:07:34.596111
2050,33669114,308972885,15,12,6,write-the-docs-quorum/quorum-meetups,"The Quorum program brings together various Write the Docs meetup chapters that are in a common time zone to provide quarterly 'super' meetups over Zoom throughout the year. These are quarterly regional remote meetups, hence the name: QRRM.","{barbaricyawps,shrielenee}",2022-02-24T21:07:34.596111
2051,33669114,166831098,16,327,1124,keptn/keptn,Cloud-native application life-cycle orchestration. Keptn automates your SLO-driven multi-stage delivery and operations & remediation of your applications.,"{bacherfl,agrimmer}",2022-02-24T21:07:34.596111
2052,33669114,13143215,17,266,986,ngs-lang/ngs,Next Generation Shell (NGS),"{ilyash,organom}",2022-02-24T21:07:34.596111
2053,33669114,1103607,18,71,18244,jenkinsci/jenkins,Jenkins automation server,"{kohsuke,jglick}",2022-02-24T21:07:34.596111
2054,33669114,65915265,19,37,313,cncf/foundation,☁️♮🏛File non-technical issues related to CNCF,"{amye,caniszczyk}",2022-02-24T21:07:34.596111
2055,33669114,345722773,20,0,21,Dev-Simulator/8-bit-env,,{mikedane},2022-02-24T21:07:34.596111
2056,33669114,92945094,21,117,1093,uswitch/kiam,Integrate AWS IAM with Kubernetes,"{pingles,rhysemmas}",2022-02-24T21:07:34.596111
2057,33669114,113106184,22,226,7904,linkerd/linkerd2,"Ultralight, security-first service mesh for Kubernetes. Main repo for Linkerd 2.x.","{alpeb,olix0r}",2022-02-24T21:07:34.596111
2058,33669114,116800189,23,4,164,dockersamples/k8s-wordsmith-demo,Sample project with Docker containers running under Kubernetes,"{BretFisher,otherguy}",2022-02-24T21:07:34.596111
2059,33669114,131619646,24,853,4121,dagster-io/dagster,"An orchestration platform for the development, production, and observation of data assets.","{schrockn,alangenfeld}",2022-02-24T21:07:34.596111
2060,33669114,36817565,25,713,9092,zaproxy/zaproxy,The OWASP ZAP core project,"{psiinon,thc202}",2022-02-24T21:07:34.596111
2061,33669114,143896900,26,387,4969,tilt-dev/tilt,Define your dev environment as code. For microservice apps on Kubernetes.,"{nicks,landism}",2022-02-24T21:07:34.596111
2062,33669114,239002506,27,17,953,sbstp/kubie,A more powerful alternative to kubectx and kubens,"{sbstp,TyBrown}",2022-02-24T21:07:34.596111
2063,33669114,143460965,28,27,11393,GoogleCloudPlatform/microservices-demo,"Sample cloud-native application with 10 microservices showcasing Kubernetes, Istio, gRPC and OpenCensus.","{ahmetb,askmeegs}",2022-02-24T21:07:34.596111
2064,33669114,116612925,29,1,821,vaidehijoshi/basecs-series,A compiled list of resources from the basecs series,{vaidehijoshi},2022-02-24T21:07:34.596111
2065,569510,13840241,0,122,27264,freeCodeCamp/devdocs,API Documentation Browser,"{Thibaut,simon04}",2022-02-24T21:07:34.596111
2066,569510,34369372,1,818,3486,shd101wyy/markdown-preview-enhanced,One of the 'BEST' markdown preview extensions for Atom editor!,"{shd101wyy,kachkaev}",2022-02-24T21:07:34.596111
2068,569510,387459183,3,0,1,george-hawkins/aletsch-2021,,"{george-hawkins,henrik-ch}",2022-02-24T21:07:34.596111
2069,569510,45355064,4,2,4834,jarun/buku,:bookmark: Personal mini-web in text,"{jarun,rachmadaniHaryono}",2022-02-24T21:07:34.596111
2070,569510,8613622,5,46,1134,nucleic/enaml,Declarative User Interfaces for Python,"{sccolbert,MatthieuDartiailh}",2022-02-24T21:07:34.596111
2071,569510,351877820,6,5,12,GuillaumeFalourd/poc-github-actions,Various proofs of concept examples using Github Actions 🤖,{GuillaumeFalourd},2022-02-24T21:07:34.596111
2072,569510,163630911,7,2,20,jsvine/visidata-plugins,A place for me to share VisiData plugins I've written.,"{jsvine,aborruso}",2022-02-24T21:07:34.596111
2073,569510,383002759,8,0,2,gitpod-io/template-datasette,"The Datasette template, configured for Gitpod (www.gitpod.io) to give you pre-built, ephemeral development environments in the cloud.",{ghuntley},2022-02-24T21:07:34.596111
2074,569510,71359796,9,29,555,open-sauced/open-sauced,🍕  This is a project to identify your next open source contribution. ,"{bdougie,0-vortex}",2022-02-24T21:07:34.596111
2075,569510,192372472,10,82,229,nix-community/poetry2nix,Convert poetry projects to nix automagically [maintainer=@adisbladis] ,"{adisbladis,gilligan}",2022-02-24T21:07:34.596111
2076,569510,163883279,11,72,20036,nektos/act,Run your GitHub Actions locally 🚀,"{cplee,catthehacker}",2022-02-24T21:07:34.596111
2077,569510,140912432,12,42,604,simonw/sqlite-utils,Python CLI utility and library for manipulating SQLite databases,"{simonw,simonwiles}",2022-02-24T21:07:34.596111
2078,569510,107914493,13,336,5654,simonw/datasette,An open source multi-tool for exploring and publishing data,"{simonw,russss}",2022-02-24T21:07:34.596111
2079,569510,332479921,14,26,207,nix-community/lorri,Your project’s nix-env [maintainer=@Profpatsch],"{Profpatsch,grahamc}",2022-02-24T21:07:34.596111
2080,569510,375818901,15,0,1,henrik-ch/financials,,"{henrik-ch,george-hawkins}",2022-02-24T21:07:34.596111
2081,569510,91948540,16,393,6180,ranaroussi/yfinance,Download market data from Yahoo! Finance's API,"{ranaroussi,bradmetz}",2022-02-24T21:07:34.596111
2082,569510,16773572,17,7,4215,geerlingguy/mac-dev-playbook,Mac setup and configuration via Ansible.,"{geerlingguy,dspolleke}",2022-02-24T21:07:34.596111
2083,569510,277568940,18,6,297,nix-dot-dev/getting-started-nix-template,"Based on nix.dev tutorials, repository template to get you started with Nix.","{domenkozar,avdv}",2022-02-24T21:07:34.596111
2084,569510,166296150,19,79,887,nmattia/niv,Easy dependency management for Nix projects,"{nmattia,zimbatm}",2022-02-24T21:07:34.596111
2085,569510,345796271,20,0,1,george-hawkins/financials,,{george-hawkins},2022-02-24T21:07:34.596111
2086,569510,83516498,21,17,17279,norvig/pytudes,"Python programs, usually short, of considerable difficulty, to perfect particular skills.","{norvig,ghurley}",2022-02-24T21:07:34.596111
2087,569510,5101141,22,714,20958,stedolan/jq,Command-line JSON processor,"{nicowilliams,stedolan}",2022-02-24T21:07:34.596111
2088,569510,302416879,23,2,142,simonw/ca-fires-history,Tracking fire data from www.fire.ca.gov,{simonw},2022-02-24T21:07:34.596111
2089,569510,211540698,24,110,1413,kmonad/kmonad,An advanced keyboard manager,"{david-janssen,slotThe}",2022-02-24T21:07:34.596111
2090,569510,368859622,25,0,2,Refinitiv-API-Samples/Article.RDPLibrary.Python.ZeroCouponCurves,Exploring RDP Instrument Pricing Analytics API for Zero Coupon Curves,{umernalla},2022-02-24T21:07:34.596111
2091,569510,257854679,26,132,414,DavHau/mach-nix,Create highly reproducible python environments,"{DavHau,tomprince}",2022-02-24T21:07:34.596111
2092,569510,151837779,27,33,393,akosbalasko/yarle,Yarle - The ultimate converter of Evernote notes to Markdown,"{akosbalasko,rodbv}",2022-02-24T21:07:34.596111
2093,569510,354689732,28,38,67,Tow-Boot/Tow-Boot,An opinionated distribution of U-Boot. — https://matrix.to/#/!JWXGMHFqMxxehcSBEN:matrix.org?via=matrix.org,"{samueldr,IreneKnapp}",2022-02-24T21:07:34.596111
2094,569510,1535009,29,34,4056,jazzband/tablib,"Python Module for Tabular Datasets in XLS, CSV, JSON, YAML, &c.","{kennethreitz,claudep}",2022-02-24T21:07:34.596111
2095,5842360,138393139,0,63,56104,trimstray/the-book-of-secret-knowledge,"A collection of inspiring lists, manuals, cheatsheets, blogs, hacks, one-liners, cli/web tools and more.","{trimstray,lbonanomi}",2022-02-24T21:07:34.596111
2096,5842360,240673378,1,22,4284,phuoc-ng/html-dom,Common tasks of managing HTML DOM with vanilla JavaScript. Give me 1 ⭐if it’s useful.,"{phuoc-ng,surajhell88}",2022-02-24T21:07:34.596111
2097,5842360,15019962,2,179,36491,tldr-pages/tldr,📚 Collaborative cheatsheets for console commands,"{owenvoke,waldyrious}",2022-02-24T21:07:34.596111
2098,5842360,171149815,3,17,39,bikenik/alfred-anki,Create New Cards into any decks with any 'Note Type'.,{bikenik},2022-02-24T21:07:34.596111
2099,5842360,119757731,4,3,2,7Geese/eslint-config-7geese,An eslint config to enforce JavaScript coding style at 7Geese.,"{himynameisdave,laytong}",2022-02-24T21:07:34.596111
2100,5842360,320142424,5,1,92,rern/rAudio-1,"Raspberry Pi audio player: AirPlay, Audio CD, Bluetooth, Multi-room, Spotify Connect, UPnP",{rern},2022-02-24T21:07:34.596111
2101,5842360,1056938,6,68,2246,mrdavidlaing/javascript-koans,Koans to learn Javascript,"{mrdavidlaing,choskim}",2022-02-24T21:07:34.596111
2102,5842360,15062869,7,1686,37454,facebook/jest,Delightful JavaScript Testing.,"{SimenB,cpojer}",2022-02-24T21:07:34.596111
2103,5842360,256725670,8,18,3482,bansal-io/pattern.css,CSS only library to fill empty background with beautiful patterns.,{bansal-io},2022-02-24T21:07:34.596111
2104,5842360,80179717,9,1,61,alexlafroscia/alfred-switch-audio-source,Alfred workflow to switch audio device,"{alexlafroscia,nodeselector}",2022-02-24T21:07:34.596111
2141,57826091,413183643,5,0,2,Vrushank264/VQVAE-PyTorch,PyTorch Implementation of Vector Quantized Variational AutoEncoders.,{Vrushank264},2022-02-24T21:07:34.596111
2105,5842360,88760614,10,69,11838,automerge/automerge,"A JSON-like data structure (a CRDT) that can be modified concurrently by different users, and merged again automatically.","{ept,orionz}",2022-02-24T21:07:34.596111
2106,5842360,118858739,11,112,18579,dwmkerr/hacker-laws,"💻📖 Laws, Theories, Principles and Patterns that developers will find useful. #hackerlaws","{dwmkerr,umutphp}",2022-02-24T21:07:34.596111
2107,72279316,398550050,0,1,145,Google-Summer-of-Code-Archive/gsoc-proposals-archive,This repository contains Accepted proposals for various Google Summer of Code organizations throughout various years!,"{imsiddhant07,dakshp07}",2022-02-24T21:07:34.596111
2108,72279316,221981891,1,447,31667,microsoft/playwright,"Playwright is a framework for Web Testing and Automation. It allows testing Chromium, Firefox and WebKit with a single API. ","{pavelfeldman,dgozman}",2022-02-24T21:07:34.596111
2109,72279316,293860197,2,12,4648,lowlighter/metrics,"📊 An infographics generator with 30+ plugins and 200+ options to display stats about your GitHub account and render them as SVG, Markdown, PDF or JSON!","{lowlighter,Nixinova}",2022-02-24T21:07:34.596111
2110,72279316,397200443,3,0,4,sidB67/CoVaccine,,{sidB67},2022-02-24T21:07:34.596111
2111,72279316,343048668,4,0,5,raghavTinker/Smart-Home-Doorbell,Smart Home project built for a secure home,"{raghavTinker,rdotjain}",2022-02-24T21:07:34.596111
2112,72279316,396419975,5,0,2,shubhank-saxena/GSoC-Final-Report,,{shubhank-saxena},2022-02-24T21:07:34.596111
2113,72279316,258254038,6,11,542,hhhrrrttt222111/Ethical-Hacking-Tools,Complete Listing and Usage of Tools used for Ethical Hacking,"{hhhrrrttt222111,bettercalln1ck}",2022-02-24T21:07:34.596111
2114,72279316,255919240,7,2,758,smv1999/CompetitiveProgrammingQuestionBank,This repository contains all the popular Competitive Programming and DSA questions with solutions for your Coding Interview Preparation. ,"{smv1999,Saviour1001}",2022-02-24T21:07:34.596111
2115,72279316,198002487,8,40,429,jaewonhimnae/boilerplate-mern-stack,"Boilerplate when you use REACT JS, MONG DB, EXPRESS JS, REDUX",{jaewonhimnae},2022-02-24T21:07:34.596111
2116,72279316,278091381,9,5,286,jobream/List-of-Learning-Resources,This collection provides a list of educational resources for Software Engineers. Feel free to add your favorite resources as well and help others in their journey of learning.,"{TheSlimCoder,CodingSpecies}",2022-02-24T21:07:34.596111
2117,72279316,191778259,10,15,172,davehowson/chat-app,MERN Stack Based Chat Application,{davehowson},2022-02-24T21:07:34.596111
2118,72279316,269152507,11,26,29,smfils1/youtube-clone,A YouTube Clone using the MERN stack,{smfils1},2022-02-24T21:07:34.596111
2119,72279316,381813837,12,1,31,Servatom/Notion-DiscordBot,"A discord bot consuming Notion API to add, retrieve data to Notion databases.","{raghavTinker,rdotjain}",2022-02-24T21:07:34.596111
2120,72279316,41589399,13,3,337,gilbox/react-track,Track the position of DOM elements. Create cool animations.,"{gilbox,andreypopp}",2022-02-24T21:07:34.596111
2121,72279316,50063599,14,15,732,mcdallas/wallstreet,Real time stock and option data.,"{mcdallas,sorying}",2022-02-24T21:07:34.596111
2122,72279316,13030144,15,504,13528,janpaepke/ScrollMagic,The javascript library for magical scroll interactions.,"{janpaepke,johnpolacek}",2022-02-24T21:07:34.596111
2123,72279316,240795158,16,0,80,KSJaay/Alita,A Discord.js bot using MongoDB (npm package Mongoose) to create a bot multipurpose,"{KSJaay,PegosStelios}",2022-02-24T21:07:34.596111
2124,72279316,384873391,17,1,42,developer-student-club-thapar/GSoC-Proposals-Archive,This repository contains Accepted and Rejected proposals for various Google Summer of Code organizations.,"{specter25,Saurav-Shrivastav}",2022-02-24T21:07:34.596111
2125,72279316,230963289,18,25,227,Paol-imi/muuri-react,The layout engine for React,"{Paol-imi,In-dev-paolo}",2022-02-24T21:07:34.596111
2126,72279316,324575078,19,3,129,Kushal997-das/Project-Guidance,:octocat:🌟 The Ultimate resources for beginner to advance level projects all at  one place 💻 🎯🚀 ,"{Kushal997-das,SamarpanCoder2002}",2022-02-24T21:07:34.596111
2127,72279316,41029539,20,7,303,alpha-miner/Finance-Python,"python tools for Finance with the functionality of indicator calculation, business day calculation and so on.",{wegamekinglc},2022-02-24T21:07:34.596111
2128,72279316,140322995,21,5,271,Finance-Hub/FinanceHub,Resources for Quantitative Finance,"{gusamarante,VFermat}",2022-02-24T21:07:34.596111
2129,72279316,7833168,22,9331,16839,elastic/kibana,Your window into the Elastic Stack,"{spalger,rashidkpc}",2022-02-24T21:07:34.596111
2130,72279316,15111821,23,2195,46120,grafana/grafana,"The open and composable observability and data visualization platform. Visualize metrics, logs, and traces from multiple sources like Prometheus, Loki, Elasticsearch, InfluxDB, Postgres and many more. ","{torkelo,bergquist}",2022-02-24T21:07:34.596111
2131,72279316,48356217,24,83,9798,haltu/muuri,"Infinite responsive, sortable, filterable and draggable layouts","{niklasramo,aslakhellesoy}",2022-02-24T21:07:34.596111
2132,72279316,297419763,25,3,1368,github/india,GitHub resources and information for the developer community in India,"{mvkaran,GitHubIndiaBot}",2022-02-24T21:07:34.596111
2133,72279316,377305568,26,0,2240,madebygps/self-taught-guide-to-cloud-computing,Learn the fundamentals of cloud computing,"{madebygps,rishabkumar7}",2022-02-24T21:07:34.596111
2134,72279316,103633984,27,38,72884,goldbergyoni/nodebestpractices,:white_check_mark:  The Node.js best practices list (December 2021),"{goldbergyoni,anediaz}",2022-02-24T21:07:34.596111
2135,72279316,109887187,28,122,826,danthareja/contribute-to-open-source,Learn the GitHub workflow by contributing code in a fun simulation project ,{danthareja},2022-02-24T21:07:34.596111
2136,57826091,412662918,0,28,52,Developer-DAO/DAO-job-board,A job board connecting DAOs with talent.,"{angeljgomezc,carlomigueldy}",2022-02-24T21:07:34.596111
2137,57826091,431203802,1,0,12,Dhaiwat10/svelte-link-preview,Svelte port of @dhaiwat10/react-link-preview,{Dhaiwat10},2022-02-24T21:07:34.596111
2138,57826091,430789888,2,22,111,Developer-DAO/web3-ui,The UI library for web3,"{etr2460,Dhaiwat10}",2022-02-24T21:07:34.596111
2142,57826091,407233777,6,17,355,slipHQ/run-wasm,Run WASM based code executions in the browser easily,"{kennethcassel,cameronmoreau}",2022-02-24T21:07:34.596111
2143,57826091,402841129,7,1,128,Developer-DAO/developer-dao-nft-contract,,{dabit3},2022-02-24T21:07:34.596111
2144,57826091,403159506,8,11,314,Developer-DAO/developerdao.com,A community of builders who believe in collective ownership of the internet,"{with-heart,fmoliveira}",2022-02-24T21:07:34.596111
2145,57826091,360522116,9,14,987,nextui-org/nextui,"🚀   Beautiful, fast and modern React UI library.","{jrgarciadev,DaniAcu}",2022-02-24T21:07:34.596111
2146,57826091,405751585,10,0,1,Dhaiwat10/sol-escrow,,{Dhaiwat10},2022-02-24T21:07:34.596111
2147,57826091,371292556,11,1,4,Nazeeh21/Meshare,"It is a question-answer website for experienced and enthusiast developers. Any developer folk, who knows the workaround of the question or knows the solution can propose it.  If the solution provided by any folk solves the question, then the question's author can tip that debugger in Ether coins.","{Nazeeh21,miralsuthar}",2022-02-24T21:07:34.596111
2148,57826091,74293321,12,609,54142,sveltejs/svelte,Cybernetically enhanced web apps,"{Rich-Harris,Conduitry}",2022-02-24T21:07:34.596111
2149,57826091,304344049,13,398,6089,sveltejs/kit,The fastest way to build Svelte apps,"{Rich-Harris,benmccann}",2022-02-24T21:07:34.596111
2150,57826091,348060227,14,118,8725,withastro/astro,"🚀🧑‍🚀 Keep your eyes to the skies, astronauts","{FredKSchott,matthewp}",2022-02-24T21:07:34.596111
2151,57826091,8843683,15,102,55699,chartjs/Chart.js,Simple HTML5 Charts using the <canvas> tag,"{etimberg,kurkle}",2022-02-24T21:07:34.596111
2152,57826091,392046190,16,0,8,Dhaiwat10/furniture-exchange,2021 Supabase launchweek hackathon entry,"{Dhaiwat10,Nazeeh21}",2022-02-24T21:07:34.596111
2153,57826091,80149262,17,484,20673,react-navigation/react-navigation,Routing and navigation for your React Native apps,"{satya164,brentvatne}",2022-02-24T21:07:34.596111
2154,57826091,214587193,18,244,25465,supabase/supabase,The open source Firebase alternative. Follow to stay updated about our public Beta.,"{kiwicopple,MildTomato}",2022-02-24T21:07:34.596111
2155,57826091,69495170,19,80,21556,fastify/fastify,"Fast and low overhead web framework, for Node.js","{delvedor,mcollina}",2022-02-24T21:07:34.596111
2156,57826091,381747084,20,0,14,Nazeeh21/Lottery-Contract,,{Nazeeh21},2022-02-24T21:07:34.596111
2157,57826091,381240280,21,2,5,Dhaiwat10/react-agora,Plug-and-play React wrapper for AgoraRTC.,"{Dhaiwat10,Nazeeh21}",2022-02-24T21:07:34.596111
2158,57826091,283728680,22,3,203,dailydotdev/apps,daily.dev application suite,"{idoshamun,rebelchris}",2022-02-24T21:07:34.596111
2159,57826091,181308113,23,18,605,calintamas/react-native-toast-message,Animated toast message component for React Native,"{calintamas,ioanabudai}",2022-02-24T21:07:34.596111
2160,57826091,121424992,24,8,833,twopluszero/next-images,"Import images in Next.js (supports jpg, jpeg, svg, png and gif images)","{arefaslani,Myoxocephalus}",2022-02-24T21:07:34.596111
2161,57826091,368185844,25,2,2,Nazeeh21/Devdit-Blockchain,"This is a decentralized website for developers where one can post and share new technologies with other developers. This website is developed entirely on the blockchain, using smart contracts built in solidity.  Developers can also encourage other developers by upvoting their posts and commenting on their posts.",{Nazeeh21},2022-02-24T21:07:34.596111
2162,57826091,369719645,26,2,72,Dhaiwat10/react-link-preview,A React library that generates beautiful previews for your links.,"{Dhaiwat10,semantic-release-bot}",2022-02-24T21:07:34.596111
2163,57826091,102210005,27,35,1470,dethcrypto/TypeChain,🔌 TypeScript bindings for Ethereum smart contracts,"{krzkaczor,zemse}",2022-02-24T21:07:34.596111
2164,57826091,361722943,28,0,1,Dhaiwat10/simple-nft,,"{rhlsthrm,krzkaczor}",2022-02-24T21:07:34.596111
2165,57826091,135786093,29,5,30556,typescript-cheatsheets/react,Cheatsheets for experienced React developers getting started with TypeScript,"{sw-yx,eps1lon}",2022-02-24T21:07:34.596111
2166,4247126,191051391,0,264,10379,redwoodjs/redwood,The App Framework for Startups,"{peterp,thedavidprice}",2022-02-24T21:07:34.596111
2167,4247126,369896619,1,17,20,OrderAndCh4oS/hicetnunc-radio,Radio player for audio tracks in a tezos wallet.,"{OrderAndCh4oS,jclayton}",2022-02-24T21:07:34.596111
2168,4247126,293844582,2,7,39,spicygreenbook/greenbook-app,,"{pleaseshutup,mrvncaragay}",2022-02-24T21:07:34.596111
2169,4247126,70137417,3,233,3779,corda/corda,"Corda is an open source blockchain project, designed for business from the start. Only Corda allows you to build interoperable blockchain networks that transact in strict privacy. Corda's smart contract technology allows businesses to transact directly, with value.","{Clintonio,exFalso}",2022-02-24T21:07:34.596111
2170,4247126,40892817,4,939,13816,ethereum/solidity,"Solidity, the Smart Contract Programming Language","{chriseth,axic}",2022-02-24T21:07:34.596111
2171,4247126,114747226,5,18,39976,deepfakes/faceswap,Deepfakes Software For All,"{torzdf,kvrooman}",2022-02-24T21:07:34.596111
2172,4247126,8681349,6,571,32864,huginn/huginn,Create agents that monitor and act on your behalf.  Your agents are standing by!,"{cantino,knu}",2022-02-24T21:07:34.596111
2173,4247126,205197166,7,0,1,twhitacre/reactatl-9319,"ReactATL Talk | Offline First Strategies | September 03, 2019",{twhitacre},2022-02-24T21:07:34.596111
2174,4247126,123979143,8,6,630,zero-to-mastery/ZtM-Job-Board,⚛️ A place for developers to show recruiters they are available for hire,"{SamirJouni,StefanSelfTaught}",2022-02-24T21:07:34.596111
2175,4247126,196662111,9,0,2,mdb1710/mnmlurl,🔗 Modern URL shortener with support for custom alias,"{liyasthomas,mdb1710}",2022-02-24T21:07:34.596111
2176,22154417,4132857,0,174,2673,insanum/gcalcli,Google Calendar Command Line Interface,"{tresni,jcrowgey}",2022-02-24T21:07:34.596111
2177,22154417,28944251,1,41,5033,arwes/arwes,Futuristic Sci-Fi UI Web Framework,"{romelperez,jdpnielsen}",2022-02-24T21:07:34.596111
2178,22154417,48869446,2,74,620,kogosoftwarellc/open-api,A Monorepo of various packages to power OpenAPI in node,"{jsdevel,MugeSo}",2022-02-24T21:07:34.596111
2179,22154417,390399632,3,0,59,codrops/SuperfluidLayout,Experimental reveal animations on typographic elements,"{crnacura,parodia}",2022-02-24T21:07:34.596111
2180,22154417,102488287,4,0,105,aleha84/simple.canvas.core2,SCG v2,{aleha84},2022-02-24T21:07:34.596111
2181,22154417,328121260,5,2,1665,timlrx/tailwind-nextjs-starter-blog,"This is a Next.js, Tailwind CSS blogging starter template. Comes out of the box configured with the latest technologies to make technical writing a breeze. Easily configurable and customizable. Perfect as a replacement to existing Jekyll and Hugo individual blogs.","{timlrx,Music47ell}",2022-02-24T21:07:34.596111
2182,22154417,256847634,6,24,400,Camberi/firecms,Awesome Firestore based CMS,"{fgatti675,zhigang1992}",2022-02-24T21:07:34.596111
2183,22154417,381979,7,685,14552,fullcalendar/fullcalendar,Full-sized drag & drop event calendar,"{arshaw,acerix}",2022-02-24T21:07:34.596111
2184,22154417,366099717,8,0,2,jfrogtraining/aws-ecs-docker-compose-workshop,,{jefferyfry},2022-02-24T21:07:34.596111
2185,22154417,387168810,9,0,112,matt765/react-chat-app,,{matt765},2022-02-24T21:07:34.596111
2186,22154417,149157946,10,0,247,lucianomlima/react-ui-kits,A list of UI Kits available for React and React Native.,"{lucianomlima,ednofedulo}",2022-02-24T21:07:34.596111
2187,22154417,231972503,11,6,4032,public-api-lists/public-api-lists,A collective list of free APIs for use in software and web development 🚀 (Clone of https://github.com/public-apis/public-apis),"{alstn2468,AlbertSuarez}",2022-02-24T21:07:34.596111
2188,22154417,380302418,12,0,73,ayushiee/fb-clone,A simple and responsive facebook clone built using Typescript and React.,"{ayushiee,karanpratapsingh}",2022-02-24T21:07:34.596111
2189,22154417,46511887,13,39,4343,searchkit/searchkit,GraphQL API & React UI components for Elasticsearch. The easiest way to build a great search experience,"{joemcelroy,ssetem}",2022-02-24T21:07:34.596111
2190,22154417,117618207,14,2,96,ChakriCherukuri/mlviz,Visualizations of machine learning models and algorithms,{ChakriCherukuri},2022-02-24T21:07:34.596111
2191,22154417,41571541,15,448,2454,inspec/inspec,InSpec: Auditing and Testing Framework,"{chris-rock,clintoncwolfe}",2022-02-24T21:07:34.596111
2192,22154417,90080868,16,65,2289,saadq/resumake.io,📝 A website for automatically generating elegant LaTeX resumes.,"{saadq,mmngreco}",2022-02-24T21:07:34.596111
2193,22154417,126577260,17,269,129835,trekhleb/javascript-algorithms,📝 Algorithms and data structures implemented in JavaScript with explanations and links to further readings,"{trekhleb,m-maksyutin}",2022-02-24T21:07:34.596111
2194,22154417,219881030,18,0,1,jseg787/random-playlist-generator,,"{jseg787,ddesir}",2022-02-24T21:07:34.596111
2195,22154417,60246359,19,1850,21223,ClickHouse/ClickHouse,ClickHouse® is a free analytics DBMS for big data,"{alexey-milovidov,alesapin}",2022-02-24T21:07:34.596111
2196,22154417,51109642,20,0,179,cezaraugusto/github-template-guidelines,Guidelines for building GitHub templates.,{cezaraugusto},2022-02-24T21:07:34.596111
2197,22154417,10395188,21,287,6481,exercism/exercism,Crowd-sourced code mentorship. Practice having thoughtful conversations about code.,"{iHiD,exercism-bot}",2022-02-24T21:07:34.596111
2198,22154417,363994683,22,10,7,GSA/usagov-benefits-eligibility,This is the for the benefits eligibility website for usa.gov.,"{r-bartlett-gsa,sknep}",2022-02-24T21:07:34.596111
2199,22154417,154548852,23,2,11,amazon-archives/aws-media-services-workflow-composer,"Create flexible, intelligent file-based video workflows on AWS using dynamic rules.","{aburkleaux-amazon,jamesiri}",2022-02-24T21:07:34.596111
